{
  "_comment": "Test fixture: 0 closed cycles (empty cycles_branch, sentinel hash).",
  "schema_version": 1,
  "dag_root_hash": "aaaa0000aaaa0000aaaa0000aaaa0000aaaa0000aaaa0000aaaa0000aaaa0000",
  "branches": {
    "identity": {
      "leaf_source_url": "https://metal.freedom-yield.com/api/identity-history.jsonl",
      "leaf_source_sha256": "0000000000000000000000000000000000000000000000000000000000000000",
      "leaf_count": 1,
      "branch_root": "1111111111111111111111111111111111111111111111111111111111111111"
    },
    "cycles": {
      "leaf_source_url": "https://metal.freedom-yield.com/api/cycle-history.jsonl",
      "leaf_source_sha256": "",
      "leaf_count": 0,
      "branch_root": "e3b0c44298fc1c149afbf4c8996fb92427ae41e4649b934ca495991b7852b855"
    }
  },
  "identity_url": "https://metal.freedom-yield.com/api/identity.json",
  "generated_at": "2026-06-21T00:00:00Z"
}
