{
	"_comment": "Synthetic schema example for /api/cycles-history.schema.v1.json. This file is NOT a snapshot of any production state — it is a fixed demonstration of the schema's shape. All hex strings, counts, URLs, and timestamps are synthetic placeholders that document field formats only. Production runtime snapshot is published at /api/cycles-history.json by scripts/operator-local/gen-identity.sh on the operator's local Mac. See docs/MERKLE_DAG_SPEC.md.",
	"$schema": "https://metal.freedom-yield.com/api/cycles-history.schema.v1.json",
	"schema_version": 1,
	"dag_root_hash": "0000000000000000000000000000000000000000000000000000000000000000",
	"branches": {
		"identity": {
			"leaf_source_url": "https://metal.freedom-yield.com/api/identity-history.jsonl",
			"leaf_source_sha256": "0000000000000000000000000000000000000000000000000000000000000000",
			"leaf_source_schema_url": "https://metal.freedom-yield.com/api/identity-history.schema.v1.json",
			"leaf_source_schema_sha256": "0000000000000000000000000000000000000000000000000000000000000000",
			"leaf_count": 1,
			"branch_root": "0000000000000000000000000000000000000000000000000000000000000000"
		},
		"cycles": {
			"leaf_source_url": "https://metal.freedom-yield.com/api/cycle-history.jsonl",
			"leaf_source_sha256": "0000000000000000000000000000000000000000000000000000000000000000",
			"leaf_source_schema_url": "https://metal.freedom-yield.com/api/cycle-history.schema.v1.json",
			"leaf_source_schema_sha256": "0000000000000000000000000000000000000000000000000000000000000000",
			"leaf_count": 2,
			"branch_root": "0000000000000000000000000000000000000000000000000000000000000000"
		}
	},
	"anchor_receipt_url": "https://metal.freedom-yield.com/api/anchor-receipt.json",
	"identity_url": "https://metal.freedom-yield.com/api/identity.json",
	"generated_at": "1970-01-01T00:00:00Z"
}
