{
  "_comment": "Merkle DAG snapshot generated by scripts/operator-local/gen-identity.sh per docs/MERKLE_DAG_SPEC.md.",
  "$schema": "https://metal.freedom-yield.com/api/cycles-history.schema.v1.json",
  "schema_version": 1,
  "dag_root_hash": "0bd4e667dcb7397c655ad4bccdef282b76d8a98cde4b67a8396790bcd07d3bb4",
  "branches": {
    "identity": {
      "leaf_source_url": "https://metal.freedom-yield.com/api/identity-history.jsonl",
      "leaf_source_sha256": "0021e4d21564c3ed5ccfbdd836d11e805b8b667d0b200f9cc55e3133a18c5856",
      "leaf_source_schema_url": "https://metal.freedom-yield.com/api/identity-history.schema.v1.json",
      "leaf_count": 1,
      "branch_root": "0021e4d21564c3ed5ccfbdd836d11e805b8b667d0b200f9cc55e3133a18c5856"
    },
    "cycles": {
      "leaf_source_url": "https://metal.freedom-yield.com/api/cycle-history.jsonl",
      "leaf_source_sha256": "3170d1405f411d3840b3c59684b6fd16f2bd52f46acd997de993171eb3ead60f",
      "leaf_source_schema_url": "https://metal.freedom-yield.com/api/cycle-history.schema.v1.json",
      "leaf_count": 1,
      "branch_root": "3170d1405f411d3840b3c59684b6fd16f2bd52f46acd997de993171eb3ead60f"
    }
  },
  "anchor_receipt_url": "https://metal.freedom-yield.com/api/anchor-receipt.json",
  "identity_url": "https://metal.freedom-yield.com/api/identity.json",
  "generated_at": "2026-07-04T04:34:42Z"
}
